[
  {
    "atomicNumber": 1,
    "symbol": "H",
    "name": "Hydrogen",
    "atomicMass": 1.008,
    "category": "nm",
    "categoryLabel": "Reactive nonmetal",
    "period": 1,
    "group": 1,
    "block": "s",
    "phaseAtSTP": "gas",
    "fact": "Most abundant element in the universe; powers stars via fusion.",
    "gridPosition": {
      "row": 1,
      "column": 1
    },
    "slug": "h"
  },
  {
    "atomicNumber": 2,
    "symbol": "He",
    "name": "Helium",
    "atomicMass": 4.003,
    "category": "ng",
    "categoryLabel": "Noble gas",
    "period": 1,
    "group": 18,
    "block": "s",
    "phaseAtSTP": "gas",
    "fact": "Second lightest element; makes your voice squeaky and balloons float.",
    "gridPosition": {
      "row": 1,
      "column": 18
    },
    "slug": "he"
  },
  {
    "atomicNumber": 3,
    "symbol": "Li",
    "name": "Lithium",
    "atomicMass": 6.94,
    "category": "am",
    "categoryLabel": "Alkali metal",
    "period": 2,
    "group": 1,
    "block": "s",
    "phaseAtSTP": "solid",
    "fact": "Lightest metal; core of modern rechargeable batteries.",
    "gridPosition": {
      "row": 2,
      "column": 1
    },
    "slug": "li"
  },
  {
    "atomicNumber": 4,
    "symbol": "Be",
    "name": "Beryllium",
    "atomicMass": 9.012,
    "category": "ae",
    "categoryLabel": "Alkaline earth metal",
    "period": 2,
    "group": 2,
    "block": "s",
    "phaseAtSTP": "solid",
    "fact": "Rigid, lightweight metal used in aerospace and X-ray windows.",
    "gridPosition": {
      "row": 2,
      "column": 2
    },
    "slug": "be"
  },
  {
    "atomicNumber": 5,
    "symbol": "B",
    "name": "Boron",
    "atomicMass": 10.81,
    "category": "me",
    "categoryLabel": "Metalloid",
    "period": 2,
    "group": 13,
    "block": "p",
    "phaseAtSTP": "solid",
    "fact": "Essential for plant growth; hardens glass and ceramics.",
    "gridPosition": {
      "row": 2,
      "column": 13
    },
    "slug": "b"
  },
  {
    "atomicNumber": 6,
    "symbol": "C",
    "name": "Carbon",
    "atomicMass": 12.011,
    "category": "nm",
    "categoryLabel": "Reactive nonmetal",
    "period": 2,
    "group": 14,
    "block": "p",
    "phaseAtSTP": "solid",
    "fact": "Backbone of all known life; forms diamond and graphite.",
    "gridPosition": {
      "row": 2,
      "column": 14
    },
    "slug": "c"
  },
  {
    "atomicNumber": 7,
    "symbol": "N",
    "name": "Nitrogen",
    "atomicMass": 14.007,
    "category": "nm",
    "categoryLabel": "Reactive nonmetal",
    "period": 2,
    "group": 15,
    "block": "p",
    "phaseAtSTP": "gas",
    "fact": "Makes up 78% of Earth's atmosphere.",
    "gridPosition": {
      "row": 2,
      "column": 15
    },
    "slug": "n"
  },
  {
    "atomicNumber": 8,
    "symbol": "O",
    "name": "Oxygen",
    "atomicMass": 15.999,
    "category": "nm",
    "categoryLabel": "Reactive nonmetal",
    "period": 2,
    "group": 16,
    "block": "p",
    "phaseAtSTP": "gas",
    "fact": "Essential for respiration; makes up 21% of the air we breathe.",
    "gridPosition": {
      "row": 2,
      "column": 16
    },
    "slug": "o"
  },
  {
    "atomicNumber": 9,
    "symbol": "F",
    "name": "Fluorine",
    "atomicMass": 18.998,
    "category": "hal",
    "categoryLabel": "Halogen",
    "period": 2,
    "group": 17,
    "block": "p",
    "phaseAtSTP": "gas",
    "fact": "Most reactive element; added to toothpaste to fight decay.",
    "gridPosition": {
      "row": 2,
      "column": 17
    },
    "slug": "f"
  },
  {
    "atomicNumber": 10,
    "symbol": "Ne",
    "name": "Neon",
    "atomicMass": 20.18,
    "category": "ng",
    "categoryLabel": "Noble gas",
    "period": 2,
    "group": 18,
    "block": "p",
    "phaseAtSTP": "gas",
    "fact": "Glows orange-red in the electric signs that bear its name.",
    "gridPosition": {
      "row": 2,
      "column": 18
    },
    "slug": "ne"
  },
  {
    "atomicNumber": 11,
    "symbol": "Na",
    "name": "Sodium",
    "atomicMass": 22.99,
    "category": "am",
    "categoryLabel": "Alkali metal",
    "period": 3,
    "group": 1,
    "block": "s",
    "phaseAtSTP": "solid",
    "fact": "Reacts violently with water; essential for nerve function.",
    "gridPosition": {
      "row": 3,
      "column": 1
    },
    "slug": "na"
  },
  {
    "atomicNumber": 12,
    "symbol": "Mg",
    "name": "Magnesium",
    "atomicMass": 24.305,
    "category": "ae",
    "categoryLabel": "Alkaline earth metal",
    "period": 3,
    "group": 2,
    "block": "s",
    "phaseAtSTP": "solid",
    "fact": "Burns with a brilliant white flame; vital in chlorophyll.",
    "gridPosition": {
      "row": 3,
      "column": 2
    },
    "slug": "mg"
  },
  {
    "atomicNumber": 13,
    "symbol": "Al",
    "name": "Aluminium",
    "atomicMass": 26.982,
    "category": "pm",
    "categoryLabel": "Post-transition metal",
    "period": 3,
    "group": 13,
    "block": "p",
    "phaseAtSTP": "solid",
    "fact": "Lightweight, corrosion-resistant metal used in aircraft and cans.",
    "gridPosition": {
      "row": 3,
      "column": 13
    },
    "slug": "al"
  },
  {
    "atomicNumber": 14,
    "symbol": "Si",
    "name": "Silicon",
    "atomicMass": 28.085,
    "category": "me",
    "categoryLabel": "Metalloid",
    "period": 3,
    "group": 14,
    "block": "p",
    "phaseAtSTP": "solid",
    "fact": "Foundation of computer chips and glass.",
    "gridPosition": {
      "row": 3,
      "column": 14
    },
    "slug": "si"
  },
  {
    "atomicNumber": 15,
    "symbol": "P",
    "name": "Phosphorus",
    "atomicMass": 30.974,
    "category": "nm",
    "categoryLabel": "Reactive nonmetal",
    "period": 3,
    "group": 15,
    "block": "p",
    "phaseAtSTP": "solid",
    "fact": "Essential to DNA and ATP; glows faintly in the dark.",
    "gridPosition": {
      "row": 3,
      "column": 15
    },
    "slug": "p"
  },
  {
    "atomicNumber": 16,
    "symbol": "S",
    "name": "Sulfur",
    "atomicMass": 32.06,
    "category": "nm",
    "categoryLabel": "Reactive nonmetal",
    "period": 3,
    "group": 16,
    "block": "p",
    "phaseAtSTP": "solid",
    "fact": "Smells of rotten eggs when combined with hydrogen.",
    "gridPosition": {
      "row": 3,
      "column": 16
    },
    "slug": "s"
  },
  {
    "atomicNumber": 17,
    "symbol": "Cl",
    "name": "Chlorine",
    "atomicMass": 35.45,
    "category": "hal",
    "categoryLabel": "Halogen",
    "period": 3,
    "group": 17,
    "block": "p",
    "phaseAtSTP": "gas",
    "fact": "Used to disinfect drinking water and swimming pools.",
    "gridPosition": {
      "row": 3,
      "column": 17
    },
    "slug": "cl"
  },
  {
    "atomicNumber": 18,
    "symbol": "Ar",
    "name": "Argon",
    "atomicMass": 39.948,
    "category": "ng",
    "categoryLabel": "Noble gas",
    "period": 3,
    "group": 18,
    "block": "p",
    "phaseAtSTP": "gas",
    "fact": "Fills incandescent bulbs to stop the filament burning out.",
    "gridPosition": {
      "row": 3,
      "column": 18
    },
    "slug": "ar"
  },
  {
    "atomicNumber": 19,
    "symbol": "K",
    "name": "Potassium",
    "atomicMass": 39.098,
    "category": "am",
    "categoryLabel": "Alkali metal",
    "period": 4,
    "group": 1,
    "block": "s",
    "phaseAtSTP": "solid",
    "fact": "Critical for nerve signals and muscle contraction.",
    "gridPosition": {
      "row": 4,
      "column": 1
    },
    "slug": "k"
  },
  {
    "atomicNumber": 20,
    "symbol": "Ca",
    "name": "Calcium",
    "atomicMass": 40.078,
    "category": "ae",
    "categoryLabel": "Alkaline earth metal",
    "period": 4,
    "group": 2,
    "block": "s",
    "phaseAtSTP": "solid",
    "fact": "Builds bones and teeth; fifth most abundant element in the body.",
    "gridPosition": {
      "row": 4,
      "column": 2
    },
    "slug": "ca"
  },
  {
    "atomicNumber": 21,
    "symbol": "Sc",
    "name": "Scandium",
    "atomicMass": 44.956,
    "category": "tm",
    "categoryLabel": "Transition metal",
    "period": 4,
    "group": 3,
    "block": "d",
    "phaseAtSTP": "solid",
    "fact": "Rare metal used in aerospace alloys and stadium floodlights.",
    "gridPosition": {
      "row": 4,
      "column": 3
    },
    "slug": "sc"
  },
  {
    "atomicNumber": 22,
    "symbol": "Ti",
    "name": "Titanium",
    "atomicMass": 47.867,
    "category": "tm",
    "categoryLabel": "Transition metal",
    "period": 4,
    "group": 4,
    "block": "d",
    "phaseAtSTP": "solid",
    "fact": "Strong as steel, half the weight; used in implants.",
    "gridPosition": {
      "row": 4,
      "column": 4
    },
    "slug": "ti"
  },
  {
    "atomicNumber": 23,
    "symbol": "V",
    "name": "Vanadium",
    "atomicMass": 50.942,
    "category": "tm",
    "categoryLabel": "Transition metal",
    "period": 4,
    "group": 5,
    "block": "d",
    "phaseAtSTP": "solid",
    "fact": "Strengthens steel; named after a Scandinavian goddess.",
    "gridPosition": {
      "row": 4,
      "column": 5
    },
    "slug": "v"
  },
  {
    "atomicNumber": 24,
    "symbol": "Cr",
    "name": "Chromium",
    "atomicMass": 51.996,
    "category": "tm",
    "categoryLabel": "Transition metal",
    "period": 4,
    "group": 6,
    "block": "d",
    "phaseAtSTP": "solid",
    "fact": "Gives stainless steel its shine and corrosion resistance.",
    "gridPosition": {
      "row": 4,
      "column": 6
    },
    "slug": "cr"
  },
  {
    "atomicNumber": 25,
    "symbol": "Mn",
    "name": "Manganese",
    "atomicMass": 54.938,
    "category": "tm",
    "categoryLabel": "Transition metal",
    "period": 4,
    "group": 7,
    "block": "d",
    "phaseAtSTP": "solid",
    "fact": "Essential trace nutrient; hardens steel.",
    "gridPosition": {
      "row": 4,
      "column": 7
    },
    "slug": "mn"
  },
  {
    "atomicNumber": 26,
    "symbol": "Fe",
    "name": "Iron",
    "atomicMass": 55.845,
    "category": "tm",
    "categoryLabel": "Transition metal",
    "period": 4,
    "group": 8,